{
  "agent": {
    "kind": "scripted_gold",
    "model": null,
    "transport": "direct"
  },
  "budgets": {
    "max_tool_calls": 40,
    "max_turns": 20,
    "tool_calls_used": 5
  },
  "duration_s": 4.27,
  "finished_at": "2026-08-02T13:31:20.826841Z",
  "limits_enforced": {
    "cpu_s": false,
    "max_file_mb": false,
    "max_processes": false,
    "memory_mb": false,
    "network": true,
    "wall_clock_s": true
  },
  "result": {
    "gates": [],
    "pass_fraction": 1.0,
    "per_test": {
      "tests.test_number::test_metric_falls_back_to_scientific_notation_outside_the_prefix_range": "passed",
      "tests.test_number::test_metric_keeps_three_significant_digits_by_default": "passed",
      "tests.test_number::test_metric_of_floating_point_zero_matches_integer_zero": "passed",
      "tests.test_number::test_metric_of_zero_honours_a_narrower_precision": "passed",
      "tests.test_number::test_metric_of_zero_honours_a_wider_precision": "passed",
      "tests.test_number::test_metric_of_zero_needs_no_prefix": "passed",
      "tests.test_number::test_metric_of_zero_still_appends_the_unit": "passed",
      "tests.test_number::test_metric_omits_the_space_before_a_degree_sign": "passed",
      "tests.test_number::test_metric_picks_the_prefix_that_avoids_leading_zeros": "passed",
      "tests.test_number::test_metric_precision_argument_widens_the_mantissa": "passed",
      "tests.test_number::test_metric_separates_a_unit_with_a_space": "passed",
      "tests.test_number::test_metric_uses_submultiple_prefixes_below_one": "passed"
    },
    "reward": 1.0,
    "submitted": true,
    "tests_passed": 12,
    "tests_total": 12
  },
  "rollout_id": "bugfix_metric_zero_domain_error#0",
  "run_id": "b3_smoke_direct",
  "schema_version": "1",
  "started_at": "2026-08-02T13:31:16.556933Z",
  "task": {
    "category": "bug_fix",
    "difficulty": "easy",
    "id": "bugfix_metric_zero_domain_error",
    "n_tests_declared": 12,
    "provenance_source": "real_repo",
    "split": "train"
  },
  "tool_calls": [
    {
      "arguments": {
        "path": "."
      },
      "index": 0,
      "name": "list_files",
      "ok": true,
      "output": "repo/\nsmoke/\nrepo/humanize/\nrepo/humanize/__init__.py\nrepo/humanize/number.py\nsmoke/test_smoke_number.py",
      "output_chars": 104
    },
    {
      "arguments": {
        "path": "repo/humanize/number.py"
      },
      "index": 1,
      "name": "read_file",
      "ok": true,
      "output": "repo/humanize/number.py lines 1-138 of 138\n    1 | #!/usr/bin/env python\n    2 | \n    3 | \"\"\"Humanizing functions for numbers.\"\"\"\n    4 | from __future__ import annotations\n    5 | \n    6 | import math\n    7 | import re\n    8 | import sys\n    9 | from typing import TYPE_CHECKING\n   10 | \n   11 | if TYPE_CHECKING:\n   12 |     if sys.version_info >= (3, 10):\n   13 |         from typing import TypeAlias\n   14 |     else:\n   15 |         from typing_extensions import TypeAlias\n   16 | \n   17 | # This type can be better defined by typing.SupportsInt, typing.SupportsFloat\n   18 | # but that's a Pyth...[+4129 chars]",
      "output_chars": 4729
    },
    {
      "arguments": {
        "content": "#!/usr/bin/env python\n\n\"\"\"Humanizing functions for numbers.\"\"\"\nfrom __future__ import annotations\n\nimport math\nimport re\nimport sys\nfrom typing import TYPE_CHECKING\n\nif TYPE_CHECKING:\n    if sys.version_info >= (3, 10):\n        from typing import TypeAlias\n    else:\n        from typing_extensions import TypeAlias\n\n# This type can be better defined by typing.SupportsInt, typing.SupportsFloat\n# but that's a Python 3.8 only typing option.\nNumberOrString: TypeAlias = \"float | str\"\n\n\ndef scientific(value: NumberOrString, precision: int = 2) -> str:\n    \"\"\"Return number in string scientific notation...[+3004 chars]",
        "path": "repo/humanize/number.py"
      },
      "index": 2,
      "name": "write_file",
      "ok": true,
      "output": "Wrote 138 lines to repo/humanize/number.py.",
      "output_chars": 43
    },
    {
      "arguments": {},
      "index": 3,
      "name": "run_tests",
      "ok": true,
      "output": "2/2 passed (smoke tests only; these are not the grading tests)",
      "output_chars": 62
    },
    {
      "arguments": {},
      "index": 4,
      "name": "submit",
      "ok": true,
      "output": "Submitted. The episode is over.",
      "output_chars": 31
    }
  ],
  "versions": {
    "nemo_gym": {
      "actual": "ec5a8136046aa0dd0c1525313654502f2fb7c42e",
      "matches": true,
      "pinned": "ec5a8136046aa0dd0c1525313654502f2fb7c42e"
    },
    "nemo_rl": {
      "actual": "55296257c96d49cd95c7d77613cb0f36bd4a4dc7",
      "matches": true,
      "pinned": "55296257c96d49cd95c7d77613cb0f36bd4a4dc7"
    },
    "platform": "Windows 11 (win32)",
    "python": "3.14.4",
    "repo_commit": "c15b4a6a5e1de46edb48dc288da56c990b0a92fc"
  }
}
